{"authority":"RUNTIME_PATH_SMOKE_ONLY_NOT_RUNTIME_ATTESTATION_ISOLATION_OR_DETONATION_AUTHORITY","captured_at":"2026-08-02T17:41:28Z","evidence":{"container_live_inspect":"sha256:911ccebb004e4572eaa71cdbe3549a92e3e35d3524bd02fcbb41c905436793b2","container_post_inspect":"sha256:ae2e2abeea154ea2ba0bda49cb0b5a3332bafbfe6b22ac833facd81fe131183e","container_pre_inspect":"sha256:b28813c3cb9e1cd8a569cbbf624a6c91b7bf817a55310161c03383328759a240","container_processes":"sha256:7492f847ae89917cf1fb6f1635cae350b8e6cbe8c8b7e6e0e3e44163669f870b","container_stderr":"sha256:e3b0c44298fc1c149afbf4c8996fb92427ae41e4649b934ca495991b7852b855","container_stdout":"sha256:e3b0c44298fc1c149afbf4c8996fb92427ae41e4649b934ca495991b7852b855","daemon_config":"sha256:62dce6acd7dce08561696323d07aa859a2af1308bceb3557f9953b5f644e68e9","docker_executable":"sha256:4a930d4c71679fbdc1e187838426be88eb5c605021d7b7ef2149f896c11d2935","helper_implementations":"sha256:9b0cd1bdca9cbd1957a86f95908fe04f8ada74f9c7ca3dffc7e5a36ffc8841e7","image_inspect":"sha256:a49c6fd1dab130865b26b8d1e7a8d99325edaef9fd74e87f7c7c0ea907ad88d6","installed_binaries":"sha256:666898f9bdd2361a3bd9d50a612fbf5e361fdb825a5a38340a80fa420d6ea3b3","runner_post":"sha256:be2374c1c00790600599e6955f25c24b1fa45e9db543ea5724a29de663a5df89","runner_pre":"sha256:be2374c1c00790600599e6955f25c24b1fa45e9db543ea5724a29de663a5df89","runtime_registration":"sha256:b4cecfc00d38add36ee0b3e9a85806925361918f79e87b9e926e81d376a7827c","runtime_version":"sha256:04bbc2477dfa4e780666aec3755f3f172a10783a97fdb2c3916c571fca91bacc"},"implementation_digest":"sha256:92594d82e743616019846bcb5af94def01cb7637f967722efa8422ed50e9178c","lock_digest":"sha256:f56bfc3e06e26e682c609d51811edf341d3f688b67f13104883265f515efe602","run_id":"b86096ddeed564a5938ae9dc1819c7a8","schema":"aragorn/gvisor-runtime-smoke-receipt/v1","status":"PASS"}